63e3554bde200418ee5ed428,8182933983,NOT SPECIFIED,1877045,1675846950611,08/02/2023 07:54:51 CST,leonardo hotel almere city center,nl_nl,11,,"Over het algemeen een fijne kamer , bad/douche zat verstopt en er ontbrak een onderdeel in de zijkant van het bad waardoor het niet veilig was voor jonge kinderen als ze in bad zouden gaan en gezien dit een familie kamer is vond ik dit wel een groot minpunt",HR_REVIEWTEXT,"Inchecken was fijn en snel , optie om ontbijt naar de kamer te brengen was ook fijn , helaas ontbrak er bij het ontbijt meerdere dingen die we hadden aangegeven.

Over het algemeen een fijne kamer , bad/douche zat verstopt en er ontbrak een onderdeel in de zijkant van het bad waardoor het niet veilig was voor jonge kinderen als ze in bad zouden gaan en gezien dit een familie kamer is vond ik dit wel een groot minpunt

Ik heb eerder in dit hotel verbleven alleen dan in een andere kamer mijn beoordeling blijft het zelfde.

Snachts veel overlast gehad van de buren maar daar valt weinig aan te doen.",Accommodation
63e3532dde200418ee5ed075,8182933824,NOT SPECIFIED,893749,1675846294257,08/02/2023 07:45:49 CST,dinarobin beachcomber golf resort & spa,de_de,6,,the bathroom I think would not hurt a little renovation,HR_REVIEWTEXT,"Unfortunately, my stay in your hotel was a bit disappointing. Compared to other 5-star hotels, there are better ones for me. Especially compared to the Trou aux Biches Beachcomber Hotel, the Dinarobin does not live up to my expectations of the Beachcomber hotel chain. The atmosphere was kind of cold - I didn't really feel welcome. The food was average & some of the staff members made a rather less motivated, partly unfriendly impression. The resort is very big and well maintained, but I wish the quality would not suffer from the - in my eyes exaggerated - size of the hotel. The bedroom is big, the bathroom I think would not hurt a little renovation.",Accommodation
63e25fcaf18431056ccf895a,8182654820,NOT SPECIFIED,89116872,1675785216396,07/02/2023 14:27:22 CST,pousada canoa ilhabela,pt_br,-1,excelente estadia.,"acessibilidade ruim por ter muitas escadas, acústica dos quartos de andares baixo ruim e distante do centro.",HR_REVIEWTEXT,"Pousada muito aconchegante, equipe atenciosa, estrutura e móveis novos, localização boa e excelente custo benefício.  
Pontos negativos; acessibilidade ruim por ter muitas escadas, acústica dos quartos de andares baixo ruim e distante do centro.",Accommodation
63e4bf02de200418ee628de5,8183100916,NOT SPECIFIED,5660562,1675939523597,09/02/2023 09:38:10 CST,bowery grand hotel,de_de,6,,"Gesundheitsgefährdender Zustand, sehr unsauber, dass es einem kurz vorm erbrechen erreicht, unwürdiger Zimmer und Bad und allgemeiner Zustand.",HR_REVIEWTEXT,"Gesundheitsgefährdender Zustand, sehr unsauber, dass es einem kurz vorm erbrechen erreicht, unwürdiger Zimmer und Bad und allgemeiner Zustand. Hilft nur ein Abriss! Personal ist auch uninteressiert ob es den Gästen gut geht. Sucht Euch lieber ein richtiges Hotel anstatt hier zu buchen !",Customer
63e01a8664374453351ab338,8181937222,NOT SPECIFIED,16284336,1675635679863,05/02/2023 21:07:18 CST,city express rosarito,es_us,-1,,Las toallas todas tiesas la abitacion tenía mal olor mucho ruido mi esposo salió contagiado del virus covid19 no tienen cuidado todos andan sin mascarilla en el comedor estaban unas personas tociendo no hay hijiene 😏😔😷,HR_REVIEWTEXT,Las toallas todas tiesas la abitacion tenía mal olor mucho ruido mi esposo salió contagiado del virus covid19 no tienen cuidado todos andan sin mascarilla en el comedor estaban unas personas tociendo no hay hijiene 😏😔😷,Customer
63e1270c1620f06be3e87e8e,8182267773,NOT SPECIFIED,24188,1675704063189,06/02/2023 16:13:00 CST,maison dupuy hotel,en_us,1,,"we think the mold in the hotel made us sick, we had to move",HR_REVIEWTEXT,"Property is old and in disrepair, we think the mold in the hotel made us sick, we had to move.  But the staff was great, gave us an immediate credit.
The pool area is really nice and it has a good restaurant/bar.",Customer
63e2a93ebfc7341a5dc5bae7,8182742046,NOT SPECIFIED,31959789,1675803591297,07/02/2023 19:40:46 CST,hotel astoria,en_us,1,,"Otherwise the room was very very very very cold, impossible to sleep, my daughter and I are still very sick from this horrible night, we had 2 blankets and it was not enough, so I told them that we had to leaving for our train at 5am, no one offered to go breakfast. . .",HR_REVIEWTEXT,"First of all they ask me to pay before leaving ""the hotel"" for our event there and leave the room key there. I thought we were in a ""Hotel"" not a ""Boarding school"" as the Expedia description. Otherwise the room was very very very very cold, impossible to sleep, my daughter and I are still very sick from this horrible night, we had 2 blankets and it was not enough, so I told them that we had to leaving for our train at 5am, no one offered to go breakfast. . . even though I paid for it. The big problem was the dirt, the bed and all the equipment was very very dirty and smelled very bad. Never ever again will it be free. And never again Expedia too... normally I had to pay 27 euros only but they told me, because you booked with Expedia, you have to give us, more money, it was around 4 euros, that's not that's much it's just for the principle.",Customer
63e1809b9b665768329ca775,8182395156,NOT SPECIFIED,882765,1675727151270,06/02/2023 22:35:07 CST,occidental at xcaret destination - all inclusive,en_ca,4,,Our balcony doors did not lock (a safety concern) and our toilet did not flush properly.,HR_REVIEWTEXT,"This is our 4th time here. We are actually first club members, but did not use our membership this time. Perhaps because it was off -season, there were challenges from our previous visits, but we never would have bought our membership is it was at the same quality as it was this visit. We had a third floor suite that leaked to the point we had to put towels on the floor to absorb the noise of the constant dropping. Our balcony doors did not lock (a safety concern) and our toilet did not flush properly. We did mention this, but nothing was done. There were a group of us, and we all had issues with our rooms, from no locking balcony doors (on the first floor, so important), to no hot water all week, no restocking of toilet paper (we had to raid a trolly when we found an open service door). The food selection was definitely not as good as the previous 3 times to the resort, but again, perhaps due to time of year or perhaps supply issues. Not sure we'll go back to this particular resort again.",Balcony
63e264b2bfc7341a5dc4af1f,8182654960,NOT SPECIFIED,3866771,1675785229849,07/02/2023 14:48:18 CST,hotel grand bittar,pt_br,-1,ruim,"Hotel com toalhas velhas, bidê, suíte com varanda sem proteção, parapeito baixo.",HR_REVIEWTEXT,"Hotel com toalhas velhas, bidê, suíte com varanda sem proteção, parapeito baixo.",Balcony
63e25862de200418ee5bc7d9,8182669443,NOT SPECIFIED,71948637,1675788651953,07/02/2023 13:55:46 CST,the moment hotel yilan by lakeshore,zh_tw,-1,不要下雨天入住,下雨天園區內有些道路泥濘，石板地易滑，須謹慎行走。,HR_REVIEWTEXT,"務必確認房費是否包含傳藝中心入場券或其他票券。因為訂房資訊沒有提到會送入場券，我們第一天自己買票進傳藝中心玩到傍晚才入住。辦理住房時收到票券，覺得扼腕。
強烈建議請飯店將行李送到房間。沒有平整的道路直達房間。在石子路上拖行，行李箱輪子可能會損壞。退房時也可請飯店將行李送至大廳。
下雨天園區內有些道路泥濘，石板地易滑，須謹慎行走。四處可見「小心地滑」的標示。
夜間在園區的燈光及指引不足。
陽台沒有景觀，也沒有戶外桌椅，只有未經整理的竹林、枯葉，以及隔壁彷彿廢墟的建築物，還有過去住客留下的菸蒂。
響應環保，房間內不提供瓶裝水。從房間前往飲水機裝水，有一小段路是沒有走廊或棚架遮蔽的，會淋雨。
喜歡房內的獨立空調。非中央空調。易於調整溫度或運轉模式。
浴室內有明顯霉斑，木作也多有變形，充分感受到宜蘭潮濕氣候對硬體設備的影響。水壓充足、溫度穩定。
床很好睡。枕頭略低。豪華一大床僅提供兩個枕頭。
早餐提供現煮的麵食，味道不錯。其他早餐品項的口味一般。
停車場與傳藝中心共用。
以上種種缺點，若是在晴天入住，想必會有截然不同的感受。",Injury2
63e25862de200418ee5bc7d9,8182669444,NOT SPECIFIED,71948637,1675788651953,07/02/2023 13:55:46 CST,the moment hotel yilan by lakeshore,zh_tw,-1,不要下雨天入住,四處可見「小心地滑」的標示。,HR_REVIEWTEXT,"務必確認房費是否包含傳藝中心入場券或其他票券。因為訂房資訊沒有提到會送入場券，我們第一天自己買票進傳藝中心玩到傍晚才入住。辦理住房時收到票券，覺得扼腕。
強烈建議請飯店將行李送到房間。沒有平整的道路直達房間。在石子路上拖行，行李箱輪子可能會損壞。退房時也可請飯店將行李送至大廳。
下雨天園區內有些道路泥濘，石板地易滑，須謹慎行走。四處可見「小心地滑」的標示。
夜間在園區的燈光及指引不足。
陽台沒有景觀，也沒有戶外桌椅，只有未經整理的竹林、枯葉，以及隔壁彷彿廢墟的建築物，還有過去住客留下的菸蒂。
響應環保，房間內不提供瓶裝水。從房間前往飲水機裝水，有一小段路是沒有走廊或棚架遮蔽的，會淋雨。
喜歡房內的獨立空調。非中央空調。易於調整溫度或運轉模式。
浴室內有明顯霉斑，木作也多有變形，充分感受到宜蘭潮濕氣候對硬體設備的影響。水壓充足、溫度穩定。
床很好睡。枕頭略低。豪華一大床僅提供兩個枕頭。
早餐提供現煮的麵食，味道不錯。其他早餐品項的口味一般。
停車場與傳藝中心共用。
以上種種缺點，若是在晴天入住，想必會有截然不同的感受。",Injury2
