NaturalId,SentenceId,Source,ADM_EXPEDIAHOTELID,CB Date of Creation,Document Date,HA_HOTELNAME,HR_DISPLAYLOCALE,HR_TPID,REVIEW_TITLE,Sentence,VerbatimType,Verbatim,Topic
63e256dc889b102e37afc2a1,8182636980,NOT SPECIFIED,17940,1675781762413,07/02/2023 13:49:16 CST,hotel classique,en_ca,4,,"not updated, microwave caught on fire(18 years old and dirty), smoke alarms not working due to no batteries available on site, no first aid on site.",HR_REVIEWTEXT,"not updated, microwave caught on fire(18 years old and dirty), smoke alarms not working due to no batteries available on site, no first aid on site.  Went 36 hours with no smoke alarm and then one beeping every 30min",Fire
63e0df9219d00a0fb0928edc,8182166965,NOT SPECIFIED,2202530,1675685650117,06/02/2023 11:08:02 CST,residhotel galerie tatry,fr_fr,-1,moyen moyen,Hotel calme sauf alarme incendie la première nuit .ça a duré bcp trop longtemps.,HR_REVIEWTEXT,"Hotel calme sauf alarme incendie la première nuit .ça a duré bcp trop longtemps. Chambre RELATIVEMENT propre, brûlures cigarette sur le sol, sanitaires propres mais odeur d égouts très importantes le premier soir, fenetre immonde pleine de dejections de pigeons HORRIBLE. Peu de papier wc disponible. Sinon pour le prix on va dire que ça va. HEUREUSEMENT que la chambre etait calme.",Fire
63e256dc889b102e37afc2a1,8182636981,NOT SPECIFIED,17940,1675781762413,07/02/2023 13:49:16 CST,hotel classique,en_ca,4,,Went 36 hours with no smoke alarm and then one beeping every 30min,HR_REVIEWTEXT,"not updated, microwave caught on fire(18 years old and dirty), smoke alarms not working due to no batteries available on site, no first aid on site.  Went 36 hours with no smoke alarm and then one beeping every 30min",Fire
63e0f1429b665768329a27c4,8182189697,NOT SPECIFIED,1157661,1675690098376,06/02/2023 12:23:30 CST,apart-hotel serrano recoletos,es_es,-1,para repetir,"nadie informaba de si era o no una falsa alarma, a las 3h de la madrugada, tengo que decir que la estancia alli fie perfecta por la ubicación, limpieza y amabilidad del personal",HR_REVIEWTEXT,"A pesar de que la primera noche saltó la alarma contra incendios y nadie informaba de si era o no una falsa alarma, a las 3h de la madrugada, tengo que decir que la estancia alli fie perfecta por la ubicación,  limpieza y amabilidad del personal.  Sin duda repetiremos. Muchas gracias",Fire
63e0f1429b665768329a27c4,8182189696,NOT SPECIFIED,1157661,1675690098376,06/02/2023 12:23:30 CST,apart-hotel serrano recoletos,es_es,-1,para repetir,A pesar de que la primera noche saltó la alarma contra incendios,HR_REVIEWTEXT,"A pesar de que la primera noche saltó la alarma contra incendios y nadie informaba de si era o no una falsa alarma, a las 3h de la madrugada, tengo que decir que la estancia alli fie perfecta por la ubicación,  limpieza y amabilidad del personal.  Sin duda repetiremos. Muchas gracias",Fire
63e1180c1691da7d759415d5,8182742015,NOT SPECIFIED,4589652,1675803520391,06/02/2023 15:09:00 CST,belvedere guest house,en_gb,3,,"smoke detector hanging down, tv cable did not reach the plug, bathroom door handle missing, shower head holder missing/damaged, window did not shut, lamp shade turn beds were very old and un comfy.",HR_REVIEWTEXT,"Terrible place, dirty, dark and dingy even in the day time.
smoke detector hanging down, tv cable didnt reach the plug, bathroom door handle missing, shower head holder missing/damaged, window didnt shut, lamp shade turn beds were very old and un comfy. 
 
wish i had spent the extra £20 and got a travel lodge. 

even for a dirt cheap over night this place it not worth it.",Fire
63e4ee45de200418ee6309d9,8183109509,NOT SPECIFIED,5583,1675951361151,09/02/2023 12:59:49 CST,hotel saint dominique,fr_fr,-1,,Seul pb ce matin la alarme incendie déclenché erreur à 8h du matin ( reveil difficile ) Personnel accueillant,HR_REVIEWTEXT,"Super hôtel ! Seul pb ce matin la alarme incendie déclenché erreur à 8h du matin ( reveil difficile ) 
Personnel accueillant",Fire
63e147524807715606c403f4,8182315914,NOT SPECIFIED,76838492,1675712811151,06/02/2023 18:30:42 CST,hamilton hotel,en_gb,3,,"Fire extingushers were located on the floor, not on the wall and were being used to prop the outside door open while cleaners were outside in the morning having a smoke.",HR_REVIEWTEXT,"The facilities were great but service was poor. I knew when booking that there was nobody on site but the emergency number was not answered quickly enough and the telephone number on the side of the property does not exist. The fire alarm went off at 5.45am so everyone evacuated but it was 40mins until the emergency number was answered and another half hour before the fire alarm engineer came out. There are no fire procedures in the rooms and no evacuation plan. This is particularly worrying with nobody on site. Luckily it was a false alarm and not a real fire. Fire extingushers were located on the floor, not on the wall and were being used to prop the outside door open while cleaners were outside in the morning having a smoke.",Fire
63e147524807715606c403f4,8182315911,NOT SPECIFIED,76838492,1675712811151,06/02/2023 18:30:42 CST,hamilton hotel,en_gb,3,,There are no fire procedures in the rooms and no evacuation plan.,HR_REVIEWTEXT,"The facilities were great but service was poor. I knew when booking that there was nobody on site but the emergency number was not answered quickly enough and the telephone number on the side of the property does not exist. The fire alarm went off at 5.45am so everyone evacuated but it was 40mins until the emergency number was answered and another half hour before the fire alarm engineer came out. There are no fire procedures in the rooms and no evacuation plan. This is particularly worrying with nobody on site. Luckily it was a false alarm and not a real fire. Fire extingushers were located on the floor, not on the wall and were being used to prop the outside door open while cleaners were outside in the morning having a smoke.",Fire
63e4d059de200418ee62b5d5,8183104288,NOT SPECIFIED,5384237,1675945465844,09/02/2023 10:52:09 CST,"villa brown rothschild, a member of brown hotels",de_de,-1,wir werden nicht wieder dort buchen,Am nächsten Morgen um 6.00 Uhr wurden wir durch den Feueralarm geweckt.,HR_REVIEWTEXT,"Wir haben das Zimmer wegen der Lage und des vermeintlich günstigen Preises gebucht ... und dem kostenlosen Parkplatz - so weit, so gut ... ! Der Parkplatz war in einem anderen Hotel, nur 300 m entfernt, aber in einer Einbahnstraße, wir brauchten 30 min, um das Auto nach der Ankunft im Verkehrschaos dorthin zu bringen. Der Empfang war freundlich, man erklärte uns, dass das Frühstück im Hotel serviert wird, wo auch der Parkplatz ist (300m entfernt). Unser Zimmer war dann im Keller mit Blick nach hinten. Ohne die Möglichkeit einen richtigen Sichtschutz zu haben. Die Betten und das Zimmer waren soweit in Ordnung. Das Bad war aber renovierungsbedürftig. Am nächsten Morgen um 6.00 Uhr wurden wir durch den Feueralarm geweckt. Wir zogen uns an, liefen zur Rezeption, niemand da. Im ganzen Hotel kein Personal, aber auch kein Feuer. Die anderen Gäste haben sich dann vor dem Hotel versammelt und gewartet. Um 6.45 Uhr ist dann Jemand gekommen und hat die Anlage abgeschaltet. Keine Entschuldigung vom Hotel. Frühstück gab es dann doch in diesem  Hotel, aber wir mussten bis nach 8.00 Uhr warten, weil noch nicht alles fertig war. Alles etwas chaotisch und nicht wirklich zu angenehm..",Fire
63e1312c1691da7d7594a004,8182291102,NOT SPECIFIED,11111195,1675708489805,06/02/2023 16:56:12 CST,david plaza hotel,pt_br,-1,12 horas de escuridão,"Boa hospedagem,poderiam melhorarem as televisões,de tubos e ultrapassadas e sem opções de programação,ocorreu uma queda de energia noturna de 12 horas,faltou uma luz de emergência no apartamento,complicado isso.",HR_REVIEWTEXT,"Boa hospedagem,poderiam melhorarem as televisões,de tubos e ultrapassadas e sem opções de programação,ocorreu uma queda de energia noturna de 12 horas,faltou uma luz de emergência no apartamento,complicado isso.",Fire
63e11e871691da7d759430a0,8182252521,NOT SPECIFIED,46291442,1675702673986,06/02/2023 15:36:39 CST,avalon suites yorkville,en_ca,4,,a smoke alarm chirped outside my door every few minutes for 4 days & nights,HR_REVIEWTEXT,"The suite was lovely but I waited 25 min for someone to meet me to let me in. They refused to answer the phone when I tried to call to see what was taking so long. The dishwasher was full of water when I arrived, and a smoke alarm chirped outside my door every few minutes for 4 days & nights. I emailed 3 days to ask for help but received none.",Fire
63e0ceec1620f06be3e70c84,8182167220,NOT SPECIFIED,69789877,1675685825182,06/02/2023 09:57:00 CST,hotel de eemhof by center parcs,nl_nl,-1,,Erg fijn Alleen jammer dat savonds het brandalarm afging Oorverdovend en lang voor er werd gereageerd Niet echt relaxed natuurlijk Voor de rest prima,HR_REVIEWTEXT,"Erg fijn
Alleen jammer dat savonds het brandalarm afging
Oorverdovend en lang voor er werd gereageerd 
Niet echt relaxed natuurlijk 
Voor de rest prima",Fire
63e0d9331620f06be3e739e9,8182145126,NOT SPECIFIED,1842001,1675684380826,06/02/2023 10:40:51 CST,itc hotel,fr_fr,20,,"Moisissure, détecteur de fumée recouvert de sac plastique.",HR_REVIEWTEXT,"La chambre proposée n’avait rien à voir avec les photos sur le site. 
Chambre en sous sols, salle sombre avec une fenêtre de toit. Qui ne fonctionnait pas. 
J’ai demandé à changer de chambre, la seconde était pire. Moisissure, détecteur de fumée recouvert de sac plastique. Électricité plus que douteuse et dans un état général salle. 
Porte avec pas d’isolation phonique proche des toilette. Donc des aller retour toute la nuit, et des gens qui attendent en discutant devant la porte.
Donc rien à voir avec le prix payer ni les photos. 
A ne surtout pas essayer, échec complet. 
Évidemment ils ont pas voulu faire de geste commercial. 

Je vous déconseille,
Il y a de très bon hôtel, à peine plus chère. 
Qui sont de vrais hôtels.",Fire
63e17056de200418ee5931e7,8182376732,NOT SPECIFIED,23584189,1675723422725,06/02/2023 21:25:42 CST,hy beach flats,pt_br,-1,deixou a desejar,Marca de sangue no sofá.,HR_REVIEWTEXT,"Apesar de estar escrito na descrição da reserva que ficaríamos no 14º andar. Quando chegamos na recepção nos foi informado que ficaríamos no quarto que estivesse disponível. Ou seja, não ficamos onde gostaríamos. Cheiro muito forte de cigarro nos corredores. Solicitamos dois cobertores na recepção e até agora estamos esperando. Nunca entregaram. A limpeza não é boa. Já que os hospedes anteriores escreveram ""Lucas Gostoso"" no espelho. E ao tomar banho conseguimos ver. Descarga barulhenta. Pia que alagava o banheiro. Marca de sangue no sofá.",Injury
63e04ef8dc57313b6dbf5579,8181997419,NOT SPECIFIED,1807800,1675649097405,06/02/2023 00:51:04 CST,rede andrade cecomtur,pt_br,-1,hospedagem deixou a desejar.,eu precisei de ajuda num certo momento por estar com o pé machucado,HR_REVIEWTEXT,"Equipe da recepção prestativos. O interfone do quarto 1407 não estava funcionando e eu precisei de ajuda num certo momento por estar com o pé machucado. A limpeza do quarto foi básica. As condições do quarto por ser um prédio antigo e que esta passando por reformas esta com fissuras nas paredes, pintura e reboco não plano. Frigobar não gelava muito. Ar condicionado bom. Janelas e cortinas mal apresentadas e emperrava a janela ao abrir. Lençol e travesseiro bom. Banheiro sem janela e sem ventilação forçada (só uma veneziana). Porta papel, porta sabonete, porta toalha, enferrujados e ineficientes. Limpeza do chão não era a melhor, tinha cabelo. Televisão não funcionava os canais. Sem acessibilidade para deficientes físicos. Um amigo que se hospedou neste hotel já tinha me falado.",Injury
63e4fdce0772b25c79f13404,8183113899,NOT SPECIFIED,76670724,1675955734463,09/02/2023 14:06:06 CST,utopic by uliv,en_ca,4,,"We DID have to be moved to another (better) room as the bathroom sink was leaking, and the pool of water on the floor created a dangerous slip and fall hazard.",HR_REVIEWTEXT,"The location is perfect and staff were excellent. We DID have to be moved to another (better) room as the bathroom sink was leaking, and the pool of water on the floor created a dangerous slip and fall hazard. Also, hallway and lobby conversations among guests and staff woke me up a few times in the late evening and early morning. We were on the ground floor, so this might be lessened with a room upstairs, but I did want a patio room",Injury
63e108c212ac50228bf7115d,8182229507,NOT SPECIFIED,4129350,1675696361258,06/02/2023 14:03:46 CST,hotel estevan,en_ca,4,,I fell very hard to the concrete causing some serious pain.,HR_REVIEWTEXT,"I was walking from the parking lot to the hotel on the sidewalk, and slipped on the ice. I fell very hard to the concrete causing some serious pain. I told the desk attendant about it and they said they would get it taken care of. But the next morning the ice was still there. Not a word from any sorta management on how I was doing or any other mention of the incident. If I was older I would have broken some bones instead of just bruises and soreness.",Injury
63e0dca49b6657683299ef64,8182150962,NOT SPECIFIED,328477,1675684920079,06/02/2023 10:55:32 CST,best western airport motel and convention centre,en_au,25,,"The steps down to my room were small and hazards and as a result i fell and hurt my ankle, i reported this to ohs and situation still continuing at this stage.",HR_REVIEWTEXT,"The steps down to my room were small and hazards and as a result i fell and hurt my ankle,  i reported this to ohs and situation still continuing at this stage. Not resolved as yet but working with management is good.",Injury
63e1a7d51691da7d75969443,8182431926,NOT SPECIFIED,62588966,1675736823790,07/02/2023 01:22:29 CST,hacienda don armando boutique & spa,es_mx,12,,Cena con un vinito caliente y un corte excelente.,HR_REVIEWTEXT,"Estuvo increíble. El lugar es extraordinariamente bonito. Calefacción. Jacuzzi climatizado. Alberca. Spa. Desayuno bastante copioso incluido. Cena con un vinito caliente y un corte excelente. Camas cómodas, habitaciones limpias con todo lo necesario. Reciben mascotas. Internet de primera. Precio suuuper accesible. Desde que reservé me contactaron, me mandaron un pdf con información, y se pusieron a las ordenes. Diseñaron un tour personalizado de acuerdo a nuestras intenciones. Amables y resolutivos al llegar.
Mil veces recomendable, y definitivamente regresaría.",Injury
63e1ecc41a50ac7aaa4f4830,8182509714,NOT SPECIFIED,9629148,1675754964939,07/02/2023 06:16:36 CST,mid city plantation motel,en_au,-1,comfortable beds,Bunk is low so easy to hit head but was clean & comfortable.,HR_REVIEWTEXT,"Beds were comfortable and clean. The room had bunks  The room had a step down going in and a step up to bathroom so that’s the only fault and falls risk possibly.
Bunk is low so easy to hit head but was clean & comfortable. 
Remote control for airconditioner was located under top bunk bed of all places!!!",Injury
63e157d41620f06be3e974bc,8182723811,NOT SPECIFIED,4027564,1675799484594,06/02/2023 19:41:08 CST,the villas at sunset lane,nl_nl,11,,It felt really good traveling on my own injured.,HR_REVIEWTEXT,I broke my elbow and I stayed here only shortly until the flight back home. The lady of the hotel was so friendly. It felt really good traveling on my own injured.,Injury
63e3c9922623560f84f220dd,8183050715,NOT SPECIFIED,32607269,1675876502573,08/02/2023 16:10:58 CST,hotel hacienda santana,es_mx,12,,"Lo que no, fue el restaurante, me hizo daño la comida (chicharron) tremenda infeccion",HR_REVIEWTEXT,"Lo rustico u moderno y amplio.
Lo que no, fue el restaurante, me hizo daño la comida (chicharron) tremenda infeccion",Injury
63e25b06f18431056ccf7b43,8182640596,NOT SPECIFIED,75790655,1675782851405,07/02/2023 14:07:02 CST,housi perdizes by charlie,pt_br,-1,excelente pelo valor,havia fios de cabelo pelo chão e toalete estava com sangue que parecia ser de menstruação,HR_REVIEWTEXT,"Apartamento excelente em prédio muito bom!
A caminhada até o Alianz Parque leva em torno de 8min e é tranquila.
Tenho apenas 3 ressalvas sobre a unidade na qual eh fiquei, no caso a 901: a tomada próxima à cama está com um pino quebrado dentro, o que impede a utilização da mesma, não consegui carregar meu celular enquanto estava deitado na cama; a limpeza deixou bastante a desejar, havia fios de cabelo pelo chão e toalete estava com sangue que parecia ser de menstruação; e por fim, a unidade não tinha wi-fi, o que não foi problema, pois usei o sinal do apartamento 903.",Injury
63e0c9c594c8cf0f3d6056e4,8182124626,NOT SPECIFIED,21174653,1675680317648,06/02/2023 09:35:01 CST,hotel tops 10,ko_kr,-1,최악의 탑스텐 레스토랑,5인가족여행으로 23년 2월 3일 저녁에 탑스텐 레스토랑에서 저녁 뷔페 이용을 했는데 굴을 먹은 2인만 다음날부터 배가 아프기 시작해서 2일후인 일요일엔 구토와 설사로 굉장히 고생했습니다 월요일에 병원가서 진료를 보니 식중독 진단을 받았습니다 호텔 레스토랑측에 전화로 문의하니 그날 뷔페 이용을 한 다른 사용자도 동일 증상으로 컨플레임이 왔었다고 하더군요,HR_REVIEWTEXT,"5인가족여행으로 23년 2월 3일 저녁에 탑스텐 레스토랑에서 저녁 뷔페 이용을 했는데 굴을 먹은 2인만 다음날부터 배가 아프기 시작해서 2일후인 일요일엔 구토와 설사로 굉장히 고생했습니다
월요일에 병원가서 진료를 보니 식중독 진단을 받았습니다
호텔 레스토랑측에 전화로 문의하니 그날 뷔페 이용을 한 다른 사용자도 동일 증상으로 컨플레임이 왔었다고 하더군요

식중독 걸린 2인에 대한 배상요구를 했더니 호텔레스토랑 담당자(과장)는 자기네 호텔 레스토랑에서 음식을 먹고 식중독에 걸렸다는 증빙을 고객이 직접 확보하지 않는 이상 보상이 어렵다고 회피만 했습니다(녹취 자료도 있습니다)
병원서류에 굴을 먹고 나서부터 속이 안좋아지기 시작했다는 내용이 있다고 말했으나 그런건 증빙자료로 받아드리기 어렵고 식약처든 보건소든 신고해서 당시(23년 2월 3일) 굴에 문제가 있었던걸 증빙하라고 말장난을 하는 행테에 기가찼습니다",Customer2
63e0c9c594c8cf0f3d6056e4,8182124627,NOT SPECIFIED,21174653,1675680317648,06/02/2023 09:35:01 CST,hotel tops 10,ko_kr,-1,최악의 탑스텐 레스토랑,식중독 걸린 2인에 대한 배상요구를 했더니 호텔레스토랑 담당자(과장)는 자기네 호텔 레스토랑에서 음식을 먹고 식중독에 걸렸다는 증빙을 고객이 직접 확보하지 않는 이상 보상이 어렵다고 회피만 했습니다(녹취 자료도 있습니다) 병원서류에 굴을 먹고 나서부터 속이 안좋아지기 시작했다는 내용이 있다고 말했으나 그런건 증빙자료로 받아드리기 어렵고 식약처든 보건소든 신고해서 당시(23년 2월 3일) 굴에 문제가 있었던걸 증빙하라고 말장난을 하는 행테에 기가찼습니다,HR_REVIEWTEXT,"5인가족여행으로 23년 2월 3일 저녁에 탑스텐 레스토랑에서 저녁 뷔페 이용을 했는데 굴을 먹은 2인만 다음날부터 배가 아프기 시작해서 2일후인 일요일엔 구토와 설사로 굉장히 고생했습니다
월요일에 병원가서 진료를 보니 식중독 진단을 받았습니다
호텔 레스토랑측에 전화로 문의하니 그날 뷔페 이용을 한 다른 사용자도 동일 증상으로 컨플레임이 왔었다고 하더군요

식중독 걸린 2인에 대한 배상요구를 했더니 호텔레스토랑 담당자(과장)는 자기네 호텔 레스토랑에서 음식을 먹고 식중독에 걸렸다는 증빙을 고객이 직접 확보하지 않는 이상 보상이 어렵다고 회피만 했습니다(녹취 자료도 있습니다)
병원서류에 굴을 먹고 나서부터 속이 안좋아지기 시작했다는 내용이 있다고 말했으나 그런건 증빙자료로 받아드리기 어렵고 식약처든 보건소든 신고해서 당시(23년 2월 3일) 굴에 문제가 있었던걸 증빙하라고 말장난을 하는 행테에 기가찼습니다",Customer2
63e0b1bf19d00a0fb091ed8a,8182102878,NOT SPECIFIED,73232,1675674712034,06/02/2023 07:52:31 CST,hotel metropolitan edmont tokyo,ja_jp,-1,受験生ママ,また、天井のダウンライトの下にいると熱かったです。,HR_REVIEWTEXT,"息子の受験のため利用しました
綺麗で立派なホテルで勿体無いくらいでした
ただ欲を言えば、机にスタンドが置かれてあり
配慮を感じられましたが、勉強するにはお部屋
自体が少し暗いかなと思いました。また、天井のダウンライトの下にいると熱かったです。決して苦情ではありません。総合的には快適でした。",Customer2
63e221e8de200418ee5b1d95,8182574745,NOT SPECIFIED,12385623,1675768486271,07/02/2023 10:03:20 CST,hotel gracery naha,ja_jp,-1,レンタカーを借りる場合は注意,モノレール駅から近く、国際通りに面している為車無しの場合は良いが、レンタカーを借りる場合は1回最大1500円がかかり、かつ近くに駐車場が借りれない場合がある為注意。,HR_REVIEWTEXT,モノレール駅から近く、国際通りに面している為車無しの場合は良いが、レンタカーを借りる場合は1回最大1500円がかかり、かつ近くに駐車場が借りれない場合がある為注意。,Customer2
63e4b2dd889b102e37b6691b,8183099350,NOT SPECIFIED,2835050,1675936726508,09/02/2023 08:46:21 CST,vien dong hotel,ja_jp,-1,微妙,最初は熱い湯が出ていたのに途中で水になり、暫くして出すとお湯が出る、そんな繰り返しだった。,HR_REVIEWTEXT,"湯船があるのにお湯が途中で水に変わり熱いお湯に浸かれなかった。最初は熱い湯が出ていたのに途中で水になり、暫くして出すとお湯が出る、そんな繰り返しだった。
チェクインしてすぐ、セイフティボックスが壊れていてドワ毎交換していた。日々のチェックをしていないのか？部屋の窓のカーテンを開けると内側の廊下が...宿泊者から丸見えなので開けることが出来なかった。変な作りのホテルだと思う。場所は近くに繁華街もコンビニもすぐ近くにあり便利だと思う。フロント女の子が親切だった。実は２回目の滞在だったが、前は別の部屋だったので問題なかったが、今回は最初から問題がありがっかりした。",Customer2
63e4b2dd889b102e37b6691b,8183099349,NOT SPECIFIED,2835050,1675936726508,09/02/2023 08:46:21 CST,vien dong hotel,ja_jp,-1,微妙,湯船があるのにお湯が途中で水に変わり熱いお湯に浸かれなかった。,HR_REVIEWTEXT,"湯船があるのにお湯が途中で水に変わり熱いお湯に浸かれなかった。最初は熱い湯が出ていたのに途中で水になり、暫くして出すとお湯が出る、そんな繰り返しだった。
チェクインしてすぐ、セイフティボックスが壊れていてドワ毎交換していた。日々のチェックをしていないのか？部屋の窓のカーテンを開けると内側の廊下が...宿泊者から丸見えなので開けることが出来なかった。変な作りのホテルだと思う。場所は近くに繁華街もコンビニもすぐ近くにあり便利だと思う。フロント女の子が親切だった。実は２回目の滞在だったが、前は別の部屋だったので問題なかったが、今回は最初から問題がありがっかりした。",Customer2
63e35396de200418ee5ed12c,8182933890,NOT SPECIFIED,10165504,1675846583905,08/02/2023 07:47:34 CST,miyako hotel hakata,ja_jp,28,,加熱？）,HR_REVIEWTEXT,スパ真下の部屋はたまに聞こえる機械（水の循環？加熱？）の音が少し気になりました。,Customer2
63e05f9d91e0356fc664decf,8182013988,NOT SPECIFIED,11821181,1675652803142,06/02/2023 02:02:05 CST,ever delightful business hotel,zh_tw,62,,吃完早餐後拉肚子,HR_REVIEWTEXT,"棉被及床都舒服

吃完早餐後拉肚子",Customer2
63e1178e1691da7d7594143b,8182247264,NOT SPECIFIED,3008903,1675701043271,06/02/2023 15:06:54 CST,hotel villa fontaine tokyo - kudanshita,ja_jp,28,,熱いものを飲むのに、やりづらい。,HR_REVIEWTEXT,"お茶を飲むカップが、薄い紙コップ。
熱いものを飲むのに、やりづらい。",Customer2
63e33ef09f99ed32c1024669,8182910173,NOT SPECIFIED,201186,1675841639533,08/02/2023 06:19:28 CST,hotel miramar am römer,de_de,6,,"Katastrophe: Drehtür mit Treppe, dadurch Sturzgefahr beim Verlassen aber kein Warnschild",HR_REVIEWTEXT,"Positiv: sauber, gut gelegen

Negativ: winzige Zimmer, durchgelegene Matratzen, kein zweiter Stuhl bei einer Buchung für zwei Personen möglich, kein Frühstück auf dem Zimmer möglich

Katastrophe: Drehtür mit Treppe, dadurch Sturzgefahr beim Verlassen aber kein Warnschild",Accommodation
